{
 "contract_version": "1.0",
 "task_id": "boot-01",
 "project_id": "bootstrap",
 "request": "对 MICP 砂柱试样做矿物相与晶桥综合解释",
 "action": "interpret.phases",
 "skill_version": "1.1.0",
 "timestamp": "2026-08-07T00:00:00Z",
 "risk_level": "medium",
 "samples": [
  {
   "id": "x1",
   "data_type": "xrd_twotheta_intensity",
   "source": "Bruker D8, Cu Ka1",
   "values": [
    29.3,
    25,
    29.35,
    60,
    29.4,
    100,
    29.45,
    60,
    29.5,
    25,
    25.0,
    30,
    25.1,
    55,
    25.2,
    90,
    25.3,
    65,
    25.4,
    35,
    32.75,
    35,
    32.8,
    55,
    32.85,
    35,
    27.05,
    30,
    27.1,
    50,
    27.15,
    30
   ]
  },
  {
   "id": "s1",
   "data_type": "sem_particle_list",
   "particle_units": "um",
   "particles": [
    [
     10,
     20,
     4.5
    ],
    [
     12,
     24,
     3.2
    ],
    [
     15,
     22,
     5.1
    ],
    [
     18,
     26,
     2.8
    ],
    [
     20,
     18,
     6.0
    ],
    [
     22,
     30,
     3.9
    ],
    [
     25,
     25,
     4.1
    ],
    [
     28,
     20,
     5.5
    ],
    [
     30,
     28,
     3.0
    ],
    [
     32,
     22,
     4.8
    ],
    [
     35,
     30,
     2.5
    ],
    [
     38,
     24,
     5.9
    ],
    [
     40,
     18,
     6.5
    ],
    [
     42,
     26,
     3.5
    ],
    [
     45,
     20,
     4.2
    ],
    [
     48,
     28,
     5.0
    ],
    [
     50,
     22,
     3.8
    ],
    [
     52,
     30,
     4.6
    ],
    [
     55,
     25,
     6.2
    ],
    [
     58,
     20,
     3.3
    ],
    [
     60,
     28,
     4.9
    ],
    [
     62,
     22,
     5.4
    ],
    [
     65,
     30,
     3.6
    ],
    [
     68,
     24,
     4.4
    ],
    [
     70,
     18,
     6.8
    ],
    [
     72,
     26,
     3.1
    ],
    [
     75,
     20,
     5.7
    ],
    [
     78,
     28,
     4.0
    ],
    [
     80,
     22,
     6.3
    ],
    [
     82,
     30,
     3.4
    ],
    [
     85,
     25,
     5.2
    ],
    [
     88,
     20,
     4.7
    ]
   ]
  },
  {
   "id": "e1",
   "data_type": "eds_spectrum",
   "channels": [
    3.4,
    3.5,
    3.69,
    3.8
   ],
   "intensities": [
    20,
    50,
    100,
    50
   ]
  },
  {
   "id": "t1",
   "data_type": "tga_curve",
   "channels": [
    25,
    200,
    600,
    800,
    900
   ],
   "intensities": [
    100,
    97,
    58,
    48,
    53
   ]
  },
  {
   "id": "f1",
   "data_type": "ftir_spectrum",
   "channels": [
    740,
    745,
    750,
    870,
    875,
    880,
    1085,
    1090,
    1485,
    1490,
    1495
   ],
   "intensities": [
    12,
    100,
    12,
    10,
    55,
    10,
    22,
    25,
    20,
    60,
    20
   ]
  }
 ]
}